{
  "id": "strength-in-numbers",
  "name": "Strength In Numbers",
  "description": "Your blood rushes as you see yourself surrounded by foes and allies alike.\nWhether it is the impulse to protect your comrades, or simply the desire to see blood, this energizes you.",
  "learning_requirements": "You must have {.name}[$.content.attribute[?(@.id=='strength')]] score of at least 3.",
  "activation_requirements": "You must be bleeding or have a injury.",
  "effects": [
    {
      "type": "effect",
      "id": "increase-strenght-1d6"
    },
    {
      "type": "effect",
      "id": "heal-ally-count"
    }
  ]
}